{
  "task_id": "V9-DRYRUN-001A",
  "decision_id": "KGEN-AIDEC-V9-DRYRUN-001",
  "reason": "Resource shortage and recession signals require a reserve review draft.",
  "priority": "P1",
  "risk_level": "R2",
  "dependencies": ["KGEN-KAIOS/V8.2/examples/resource.example.json", "KGEN-KAIOS/V8.3/examples/resource_regeneration.example.json"],
  "input_state": ["Resource State", "Governance Signals", "Event Stream"],
  "expected_output": "Draft report recommending resource reserve stabilization options.",
  "acceptance_criteria": ["No protected paths modified.", "All recommendations remain simulation-only.", "Codex Review required before OPEN."],
  "protected_paths": ["contracts", "K線西遊記/temples/12345", "wallet", "bridge", "PRIMEFORGE_GENESIS_BOOT_SEQUENCE.md", "docs/physics/KGEN_Universe_Physics_Runtime_CURRENT.md", "docs/physics/final-whitepaper/", "KGEN/contracts/KGEN_Token_V7_5_2.sol"],
  "owner_suggestion": "Cursor",
  "reviewer": "Codex",
  "branch_pattern": "cursor-handoff/V9-DRYRUN-001A",
  "report_path": "KGEN-KAIOS/V9.0/reports/V9-DRYRUN-001_REPORT.md",
  "human_review_required": false,
  "codex_review_required": true,
  "status": "DRAFT"
}
